,Number,Title,Description,Link
0,"Season 132, Episode 11","A Taste of Chang Mai, Thailand","Aspiring chef Flora has always been interested in learning about Northern Thai cuisine, and the culinary school graduate is ready to fully immerse herself in the country's rich flavors with a move to her husband Note's hometown of Chiang Mai. But in Thailand, the modern kitchen that Flora is used to is almost nonexistent, and with Note setting a hard line on price, cooking in Chiang Mai may be a tough order to fill.",https://www.hgtv.com/shows/house-hunters-international/episodes/a-taste-of-chang-mai-thailand
1,"Season 132, Episode 12","New Love, New Home, New Rules in Sydney","A newly engaged couple that has never left Philadelphia or lived under the same roof together decides to take the leap and move to Sydney to pursue a job opportunity. But these two are challenged to figure out their new country, new home and new set of relationship rules with nothing familiar around to hold them back or prop them up.",https://www.hgtv.com/shows/house-hunters-international/episodes/new-love-new-home-new-rules-in-sydney
2,"Season 132, Episode 13",A Family Feud in Freising,"After eight years in Canada, a couple decides to move with their two young children to his native Freising, Germany. He hopes to relive his childhood experiences there with his children, however she has her mind set on the Bavarian countryside. While the move is intended to bring this young family closer together, they must reconcile visions that are worlds apart.",https://www.hgtv.com/shows/house-hunters-international/episodes/a-family-feud-in-freising
3,"Season 133, Episode 1",Stress Less in Cabo,"A San Diego couple is looking to regain control of their lives. Believing that a scenery change will do wonders for his high blood pressure, she's pushing for a move to Cabo San Lucas. There's no such thing as a truly stress-free life, and worries about money will follow them across the border.",https://www.hgtv.com/shows/house-hunters-international/episodes/stress-less-in-cabo
4,"Season 133, Episode 2",Swimming to Limerick,"Competitive swim coaches Mark and Sarah were ready to jump the pond when she was offered a position in Limerick, Ireland. Rents in Limerick are high and living on one income will be an adjustment. He wants to be comfortable, but finding his ""Little Irish Castle"" for $1,400 a month will be like hunting for a pot of gold at the end of the rainbow.",https://www.hgtv.com/shows/house-hunters-international/episodes/swimming-to-limerick
5,"Season 133, Episode 3","Ready or Not in Bristol, England","Erin and Sean have always lived in California with their two daughters and two dogs. When Sean was offered a position in Bristol, England, he shocked his wife by taking it. Erin had no plans to leave her teaching job of 18 years or the beautiful California weather. Finally convinced it would be a great opportunity for the kids, Erin is a newbie stay-at-home mom who makes it her business to find a home that suits her just right.",https://www.hgtv.com/shows/house-hunters-international/episodes/ready-or-not-in-bristol-england
6,"Season 133, Episode 4",Canadians in Cambodia,"Bored with life in Vancouver, millennials Nick and Raychel are moving to Cambodia sight unseen for the adventure of a lifetime. Skater Nick's laid-back personality suits the relaxed and simple living offered in Phnom Penh, but Raychel realizes that she may be in over her head. Her quest for western amenities is harshing Nick's chill vibes, but he hopes she can come around to his way of thinking.",https://www.hgtv.com/shows/house-hunters-international/episodes/canadians-in-cambodia
7,"Season 133, Episode 5","Have Baby, Will Travel","A globetrotting couple follows a job opportunity to Johor Bahru, Malaysia, to prove having a baby doesn't mean settling down. However, the only thing they agree on is that the city's lush greenery offers a better environment for raising their son.",https://www.hgtv.com/shows/house-hunters-international/episodes/have-baby-will-travel
8,"Season 133, Episode 6",Opposites Attract in Tamarindo,"After vacationing in Tamarindo, Costa Rica, an overworked couple fell in love with the climate, beach and laidback lifestyle. They both want to get away from long commutes and spend more time together, but he wants a rustic and remote hideaway while she wants something modern and centrally located.",https://www.hgtv.com/shows/house-hunters-international/episodes/opposites-attract-in-tamarindo
9,"Season 133, Episode 7","Haunting in Kaiserslautern, Germany","A military family is moving to Kaiserslautern, Germany, and need a large home. They know European houses are usually smaller, but she is determined to find an old house with quintessential German charm. He's dreadfully afraid of ghosts, though, and convinced that old German houses will have old German secrets.",https://www.hgtv.com/shows/house-hunters-international/episodes/haunting-in-kaiserslautern-germany
10,"Season 133, Episode 8","Love and Patio in Essaouira, Morocco","Elena and Bill created their own advertising and design firm in Dallas, Texas. After 14 years of owning and running a stressful business they're finally ready to hand daily operations over to their son and work remotely in Morocco. Elena wants to live in the bustling medina quarter, but Bill wants a rooftop terrace with an ocean view.",https://www.hgtv.com/shows/house-hunters-international/episodes/love-and-patio-in-essaouira-morocco
11,"Season 133, Episode 9",Hitting Reset in Bocas del Toro,"A woman hit the reset button after a difficult divorce with a trip to Bocas del Toro, Panama, and now she's back with a big dream and a tiny budget to find a new place to call home.",https://www.hgtv.com/shows/house-hunters-international/episodes/hitting-reset-in-bocas-del-toro
12,"Season 133, Episode 10",A Second-generation Adventure,"Experiencing West Africa as a kid left a huge impression on a woman's life, and now she has an opportunity to return to Senegal for work. The timing doesn't work for her husband, so their young son is tagging along to help find a place the whole family can eventually enjoy.",https://www.hgtv.com/shows/house-hunters-international/episodes/a-second-generation-adventure
13,"Season 133, Episode 11",A Crossroads in Luxembourg,"Two Denver parents jump at the opportunity to take a job offer in Luxembourg so they can expose their son to a wide world of art and culture. Dad is excited to live in Luxembourg's striking countryside, but with no work visa Mom's on a mission to push him closer to central Luxemborg. At the end of the day they'll have to agree on the option that's best for their son.",https://www.hgtv.com/shows/house-hunters-international/episodes/adulthood-adventure-in-madrid
14,"Season 133, Episode 12",Making Moves in Medellin,"A couple of opposites who have been together for 27 years decide to move from comfy California to Medellin, Colombia, but their different agendas may finally cause a snag.",https://www.hgtv.com/shows/house-hunters-international/episodes/making-moves-in-medellin
15,"Season 133, Episode 13",To Work or Not to Work in Lake Como,"A father with a hectic professional life convinced his family to take an extended vacation to the calm and peaceful haven of Lake Como, Italy, to help relieve his work stress. But the lure of a satellite office in nearby Milan is skewing his priorities, and it will be a full-time job for his wife and kids to remind him why they came here in the first place.",https://www.hgtv.com/shows/house-hunters-international/episodes/to-work-or-not-to-work-in-lake-como
16,"Season 134, Episode 1",The Catania Conundrum,"Michael has spent much of his marriage to Lois deployed as a member of the U.S. Navy. Now he's being transferred to Catania, Italy, on a three-year assignment, and although they're excited to be together with their daughters, the couple is discovering that their wish lists couldn't be further apart. Lois wants Italian charm, but Michael is pushing for practicality with a view.",https://www.hgtv.com/shows/house-hunters-international/episodes/the-catania-conundrum
17,"Season 134, Episode 2",A Three-Country Tour,"After a lifetime in small-town America, Cort took a big step by applying for a new position abroad. Now he and his family are headed to Luxembourg for a bold adventure. The tiny country that borders Germany and France has everything to offer, but the higher cost of living may literally drive Cort and his family out of the country to find a place to live.",https://www.hgtv.com/shows/house-hunters-international/episodes/a-three-country-tour
18,"Season 134, Episode 3",Luck of the Irish,"This couple fell in love with the Ireland when their son studied abroad there. Now they're hoping to lead a more relaxed life in the Emerald Isle but with change comes friction. She wants to take a break from working and experience city life but as the sole provider, he's hoping to stay close to his job. These two are no strangers to bickering but tensions reach an all-time high when the pot of gold they were looking for isn't at the end of the rainbow.",https://www.hgtv.com/shows/house-hunters-international/episodes/luck-of-the-irish
19,"Season 134, Episode 4",Fiji's Hidden Luxury,"A man is ready to move his family from Canada to his native Fiji to spend more time together as a family. While they're highly motivated to make the move, however, there are many risks and limitations. Living off a single income, the family hopes to live simply like the happy-go-lucky locals but all bets are off once they get a taste of affordable Fijian luxury.",https://www.hgtv.com/shows/house-hunters-international/episodes/fijis-hidden-luxury
20,"Season 134, Episode 5",Hitting the Links in Aalborg,"After a golfer from Denmark fell in love with a Texas college student, the pair began a long-distance relationship that eventually turned into marriage. Now married and with a baby on the way, the couple is ready to settle in his hometown of Aalborg, Denmark, where they can start a family, focus on his golf career and see what other surprises are in store.",https://www.hgtv.com/shows/house-hunters-international/episodes/hitting-the-links-in-aalborg
21,"Season 134, Episode 6",Baby Girl Meets Orvieto,"An entrepreneur and new mom is ready to return to the beloved small town of Orvieto, Italy, where she studied abroad. She hopes to start a travel club for American girls but living with a two-year-old in medieval Italy isn't the same as visiting as a freewheeling student. With an ex-pat property expert as her guide, this new mom will have to choose between what she wants and what she actually needs.",https://www.hgtv.com/shows/house-hunters-international/episodes/baby-girl-meets-orvieto
22,"Season 134, Episode 7",A Sea Queen in Sydney,"South African natives are taking their young family to Sydney, Australia, to get a warmer climate and more time together. Since she's sacrificing everything she's ever known to make this move, she's hoping to live the life of a housewife by the sea -- but will he play along?",https://www.hgtv.com/shows/house-hunters-international/episodes/a-sea-queen-in-sydney
23,"Season 134, Episode 8",Amsterdam For Young Lovers,"After spending their whole lives in Australia, a couple of adventurous world travelers packed their bags for the Netherlands and didn't look back. They're young, in love and fear nothing, but settling in Amsterdam may require more than hugs and kisses at their price point.",https://www.hgtv.com/shows/house-hunters-international/episodes/amsterdam-for-young-lovers
24,"Season 134, Episode 9",Startup in Singapore,"A Washington, DC, lawyer wants to trade in his comfortable lifestyle for adventure, excitement and possibility in Southeast Asia. He decides to push his boundaries by quitting his job to join a tech startup in Singapore.",https://www.hgtv.com/shows/house-hunters-international/episodes/startup-in-singapore
25,"Season 134, Episode 10",Next Generation in Dubrovnik,"With three small kids growing before their eyes, a Florida couple has decided to slow down and appreciate life more in his storied childhood hometown of Dubrovnik, Croatia. She's a small-town girl who is easily charmed by the historic old city and is excited about what the experience will bring to their family. But between him trying to recreate the past and her trying to adapt, happiness may lie in compromise.",https://www.hgtv.com/shows/house-hunters-international/episodes/next-generation-in-dubrovnik
26,"Season 134, Episode 11",Drawn to Life in Stockholm,"After the birth of their child, a Toronto animator and his wife decided it was time for more stability than his freelance paycheck provided. He landed a full-time gig in Stockholm, Sweden, but she's the one drawing all the lines while they hunt for a new home.",https://www.hgtv.com/shows/house-hunters-international/episodes/drawn-to-life-in-stockholm
27,"Season 134, Episode 12",Family Values in Spain,"After landing in the city following a job opportunity, a couple is staying in Chipiona, Spain, for the family values. They've decided to start a family but are split when it comes to whether they should rent or buy. He's attracted to the long-term value and the ability to customize a purchased home but she's stuck on the practicality that comes with renting so she can stay stress-free while carrying their child.",https://www.hgtv.com/shows/house-hunters-international/episodes/family-values-in-spain
28,"Season 134, Episode 13",Liffey Runs Through It,"Newlyweds head to Dublin, Ireland, when he's given a job offer in the city. His wife was thrilled to hear it but she had just started her dream job in Minneapolis and isn't so sure she wants to give it up. The couple strikes a deal that if they move to Dublin, they'll find a home downtown so she can feel the heartbeat of the new city -- a plan that made perfect sense until he saw the price tag. Now the couple must decide if she's going to concede once again to keep the marriage on track or if he's going to bite the bullet and go over budget to honor her big sacrifice.",https://www.hgtv.com/shows/house-hunters-international/episodes/liffey-runs-through-it
29,"Season 135, Episode 1","Falling in Love with Wroclaw, Poland","After falling in love with Poland and its culture, a young entrepreneur is moving to Wroclaw to develop his business. He hopes to be close to the action with a home in the city center, but he also wants some outdoor space.",https://www.hgtv.com/shows/house-hunters-international/episodes/falling-in-love-with-wroclaw-poland
30,"Season 135, Episode 2",Touchdown in Poland,"A job opportunity is bringing a young football player and coach to the Polish seaside city of Gdynia. With help from his friend, this laid-back bachelor looks for a place that is centrally located but not too expensive.",https://www.hgtv.com/shows/house-hunters-international/episodes/touchdown-in-poland
31,"Season 135, Episode 3",A New Baby and New Life in Katowice,"Soon-to-be parents have decided to give up their hectic lives in London and find a new home where they can focus more on free time. This Polish-British couple is looking for a spacious property in Katowice, Poland, that will fit their growing family, offer outdoor space for the kids and provide extra space for work.",https://www.hgtv.com/shows/house-hunters-international/episodes/a-new-baby-and-new-life-in-katowice
32,"Season 135, Episode 4",A Taste of a New Life in Prague,"An energetic dance instructor has decided to leave her empty nest in Ohio and take up teaching English in Prague, Czech Republic. While looking for an apartment, she'll hopes to reconcile her passion for both traveling and cooking but doesn't want to compromise when it comes to affordability and space.",https://www.hgtv.com/shows/house-hunters-international/episodes/a-taste-of-a-new-life-in-prague
33,"Season 135, Episode 5",A Family Adventure in Budapest,"A craving for adventure brings a family of three to Budapest. The young couple is excited to turn their lives upside down, but they have differing expectations for their new home. He wants to be close to the vibrant city center, while she would like to live in a quiet, family-friendly neighborhood.",https://www.hgtv.com/shows/house-hunters-international/episodes/a-family-adventure-in-budapest
34,"Season 135, Episode 6",Back to Her Roots in Budapest,A young woman gives up her American life to rediscover her roots in Budapest. She has a healthy budget to purchase a comfortable flat to start her new life but is unprepared for the surprises awaiting her in the quirky real estate market.,https://www.hgtv.com/shows/house-hunters-international/episodes/back-to-her-roots-in-budapest
35,"Season 135, Episode 7",New Chapter in Budapest,"Starr and Norbert have always loved traveling, and with a baby on the way, they've decided to move to Budapest so they can travel around Europe and reconnect with Norbert's Hungarian family. The couple is looking for a spacious apartment that fits their growing family and is an inspiring place for Norbert to work at home. However, Norbert dreams of living on the Buda side of the city while Starr wants to live closer to the city center.",https://www.hgtv.com/shows/house-hunters-international/episodes/new-chapter-in-budapest
36,"Season 135, Episode 8",Fresh Start in Warsaw,"In search of a new life, a woman is leaving the US and her career in banking to teach English in Warsaw, Poland. She's eager to embrace the European lifestyle and is looking for an affordable, centrally-located apartment with a great kitchen and outdoor space for her cat.",https://www.hgtv.com/shows/house-hunters-international/episodes/fresh-start-in-warsaw
37,"Season 135, Episode 9","Make Room for Six in Krakow, Poland","A couple seizes a once-in-a-lifetime opportunity and moves their family of six to Krakow, Poland. After living hectic lives apart in the US, they want to spend more time together in a home that has enough room for everyone.",https://www.hgtv.com/shows/house-hunters-international/episodes/make-room-for-six-in-krakow-poland
38,"Season 135, Episode 10",New Possibilities in Krakow,"A couple is trading their career-oriented lives in Nevada for culture-filled city lives in Krakow, Poland. While they want to live as close to the city's Old Town as possible, finding a home that checks all the boxes on their wish list -- including a parking space for their car -- proves difficult in the city center.",https://www.hgtv.com/shows/house-hunters-international/episodes/new-possibilities-in-krakow
39,"Season 135, Episode 11","Hipsters in Warsaw, Poland","A young couple from North Carolina leaves their peaceful life in Charlotte for the vibrant city of Warsaw, Poland. They want to be close to his siblings and develop their interests in film and photography, so they search for a home close to the city center and nature.",https://www.hgtv.com/shows/house-hunters-international/episodes/hipsters-in-warsaw-poland
40,"Season 135, Episode 11","Hipsters in Warsaw, Poland","A young couple from North Carolina leaves their peaceful life in Charlotte for the vibrant city of Warsaw, Poland. They want to be close to his siblings and develop their interests in film and photography, so they search for a home close to the city center and nature.",https://www.hgtv.com/shows/house-hunters-international/episodes/hipsters-in-warsaw-poland
41,"Season 135, Episode 12",Jumping in Prague,"A Canadian woman is leaving both her home and family to go on a European adventure! She fell in love with the area the first time she visited and hopes her best friend can help her find the perfect home in historic Prague, Czech Republic.",https://www.hgtv.com/shows/house-hunters-international/episodes/jumping-in-prague
42,"Season 135, Episode 13",Newlyweds in Prague,"Philadelphia newlyweds have decided to make Prague, Czech Republic -- one of Europe's most romantic cities -- their new home. They hope their European adventure will be centered in an apartment that will blend the city's old, historic feel with elegant modernity but have a difficult time finding a place that's both close to his job and near the city center.",https://www.hgtv.com/shows/house-hunters-international/episodes/newlyweds-in-prague
43,"Season 135, Episode 14",Falling in Love with Malta,"A couple is leaving their stressful lives behind in England to search for a new home in sunny Malta. Starting a new chapter is always exciting but the couple can't agree when it comes to finding an ideal home. He likes modern interiors and enjoys a city vibe but she's more into quiet areas and would love to live on the countryside, making it difficult for the duo to agree on their true dream home.",https://www.hgtv.com/shows/house-hunters-international/episodes/falling-in-love-with-malta
44,"Season 135, Episode 2",Fan Faves: Touchdown in Poland,"Check out this fan favorite as a young football player and coach follow a job opportunity to the Polish seaside city of Gdynia. With help from his friend, the laid-back bachelor hopes to find a place that is centrally located and not too expensive.",https://www.hgtv.com/shows/house-hunters-international/episodes/fan-faves-touchdown-in-poland
45,"Season 136, Episode 1",Parent Roommates in Slovenia,"A couple decides to help their son plant roots in their ancestral Slovenia. However, it's growing pains all over again as Mom wants to get him a place where she can visit, and he has reservations about sharing a space with his parents.",https://www.hgtv.com/shows/house-hunters-international/episodes/parent-roommates-in-slovenia
46,"Season 136, Episode 2","Diving Deep in Malaga, Spain","Yvette, Chad and their three kids are moving back to her hometown of Malaga, Spain, from Branson, Missouri. He's passionate about teaching scuba and the Southern coast of Spain is the perfect place to launch a new business. She wants to be close to the city and culture, but he wants a private pool in the suburbs.",https://www.hgtv.com/shows/house-hunters-international/episodes/diving-deep-in-malaga-spain
47,"Season 136, Episode 3",Newlyweds in the Old Country,"After years of dating long-distance, a woman leaves North Carolina to start life with her new husband in Bury St Edmunds, England. She longs to live near the center of town in a place with historic charm, but he prefers the countryside with plenty of space for a garden.",https://www.hgtv.com/shows/house-hunters-international/episodes/newlyweds-in-the-old-country
48,"Season 136, Episode 4",Family Memories in Mexico,"A mom and daughter love traveling together, but now that the daughter has a young family of her own, it's harder to take trips. They decide to get a family condo in Puerto Penasco, Mexico, where they can spend time together as a family. However, while one wants a fixer-upper, the other demands a move-in ready place so they can start making memories right away.",https://www.hgtv.com/shows/house-hunters-international/episodes/family-memories-in-mexico
49,"Season 136, Episode 5",Family Magic in Merida,"A young North Carolina family moves to Merida, Mexico, to work remotely and broaden their sons' horizons. With the kids' school located halfway between Merida and the beach, they must decide to stay in town or on the Gulf of Mexico.",https://www.hgtv.com/shows/house-hunters-international/episodes/family-magic-in-merida
50,"Season 136, Episode 6","Wine Not Move to Querétaro, Mexico","A Florida couple looks to relocate internationally to the vineyard-rich Queretaro region of Mexico for his online wine business. However, with only $500 to spend per month on a rental, they will have to be willing to downsize.",https://www.hgtv.com/shows/house-hunters-international/episodes/wine-not-move-to-quertaro-mexico
51,"Season 136, Episode 7","Property Expert Faceoff in Cuernavaca, Mexico","A Beverly Hills real estate agent and interior designer is looking for a slower-paced lifestyle near his mother in Cuernavaca, Mexico. He adores the Spanish colonial-style homes with their expansive gardens, but his agent thinks he should consider something that requires less time and attention.",https://www.hgtv.com/shows/house-hunters-international/episodes/property-expert-faceoff-in-cuernavaca-mexico
52,"Season 136, Episode 8",Beach or Bust,"A couple's dream of living abroad comes true when he lands a job in Melbourne, Australia. He wants a home that offers a short commute so he can spend more time with the kids. However, she has her sights set on living close to the beach, which could cause his commute to be a nightmare.",https://www.hgtv.com/shows/house-hunters-international/episodes/beach-or-bust
53,"Season 136, Episode 9",New Beginning in Melbourne,"A Connecticut man decides to leave everything behind to accept a job offer in Sydney, Australia, only to find out the position was moved to Melbourne at the last minute. Now he has no choice but to start anew in a city he doesn't know.",https://www.hgtv.com/shows/house-hunters-international/episodes/new-beginning-in-melbourne
54,"Season 136, Episode 10",From Tundra to Down Under,"Newlyweds Adam and Nameeta are moving from Canada to Newcastle, Australia, to follow Adam's job at an expanding auction house. With no support system and a new marriage, their different ideas of the perfect house are just a couple of the challenges they'll face.",https://www.hgtv.com/shows/house-hunters-international/episodes/from-tundra-to-down-under
55,"Season 136, Episode 11",Come Home to Rome,New Jersey parents with a daughter studying abroad decide to buy a family home in Rome that will double as her school digs. The challenge is finding an apartment that supports her temporary academic life but will outlast her degree.,https://www.hgtv.com/shows/house-hunters-international/episodes/come-home-to-rome
