,Number,Title,Description,Link
49,"Season 113, Episode 8",Home Sweet Edinburgh,"After 22 years in the States, Andrew and his husband, Jon, are moving to Edinburgh, Scotland, to be near Andrew's aging mother. When it comes to choosing a home, Jon can only see the romance of a historical building, but Andrew prefers the modern conveniences he loved in America.",https://www.hgtv.com/shows/house-hunters-international/episodes/home-sweet-edinburgh
50,"Season 113, Episode 9",Money's Worth in Perth,"A couple living in Alaska decides to find a new job opportunity in his native Australia. After finding a job in the city of Perth, they set off with their daughters to find a new home and put down roots down under. But while she wants to live close to town and near the girls' school, he's concerned about costs and isn't sure they can afford some of his wife and daughters' expensive requests.",https://www.hgtv.com/shows/house-hunters-international/episodes/moneys-worth-in-perth
51,"Season 113, Episode 10",Old Friends in Oslo,"With her current job coming to an end, a Bay Area woman considers a job opportunity in her high school best friend's native Norway. A new job and a chance to once again live in the same town as her friend is an enticing offer, but she is concerned about making it through her first real winter. With her dog and her reunited best friend in tow, she is ready to try and find a place to live in Oslo.",https://www.hgtv.com/shows/house-hunters-international/episodes/old-friends-in-oslo
52,"Season 113, Episode 11",Slowing Down in Tuscany,"A hard-working Nashville couple decides it's time to find a place where they can kick back and relax. They agree to look in the Northern Tuscan region of Garfagnana, Italy, and hope the lesser-known town near Lucca will allow them to find a charming home in a dramatic hilltop village while staying under budget. The homes are dated, however, so the couple must decide if it's worth paying more for a turnkey home before managing a costly renovation in a foreign country.",https://www.hgtv.com/shows/house-hunters-international/episodes/slowing-down-in-tuscany
53,"Season 113, Episode 12",Southside Class in Dublin,"An Amsterdam family looks to share their life of global citizenship with their daughter by moving o Dublin, Ireland. They're hoping to find a home in the more expensive and exclusive Southside, but they'll have to be careful and keep a close eye on their budget if they want this Irish house hunt to be a success.",https://www.hgtv.com/shows/house-hunters-international/episodes/southside-class-in-dublin
54,"Season 113, Episode 13",Nitpicking the Netherlands,"After years in a demanding advertising job, a man follows a job opportunity to Amsterdam. He brings his best friend to help him explore the area and find a home, but when he starts nitpicking, she struggles to help him find the perfect home.",https://www.hgtv.com/shows/house-hunters-international/episodes/nitpicking-the-netherlands
55,"Season 114, Episode 1",Young Family in Warsaw,"A couple and their kids are following his job offer to Poland's vibrant capital of Warsaw. They want a house in a great location with a garden, but finding it may be a challenge with the kids' welfare being their biggest priority.",https://www.hgtv.com/shows/house-hunters-international/episodes/young-family-in-warsaw
56,"Season 114, Episode 2",Slowing Down in Budapest,"A couple from Florida is ready for a change with a move to Budapest, Hungary. They must decide what compromises they are willing to make as they search for a quiet apartment close to the city with enough space to work from home.",https://www.hgtv.com/shows/house-hunters-international/episodes/slowing-down-in-budapest
57,"Season 114, Episode 3",Waltzing to Budapest,"A former ballet dancer is looking for a slower-paced lifestyle and wants a new start in Budapest, Hungary. A demanding client with a healthy budget, she hopes to find the ideal home close to the heart of the city.",https://www.hgtv.com/shows/house-hunters-international/episodes/waltzing-to-budapest
58,"Season 114, Episode 4",Finding Zen in Krakow,"A couple decides to rediscover her Polish roots and find their life Zen again in Krakow. He is focused on interesting interior design, while she craves a balcony both for practicing yoga and having a mini-garden. With Krakow's centrally located properties usually coming without a balcony, it might be hard to find a property that will satisfy the needs of both of them.",https://www.hgtv.com/shows/house-hunters-international/episodes/finding-zen-in-krakow
59,"Season 114, Episode 5",Malta Discovered,"A couple has decided to explore the breathtaking landscapes and promising business opportunities in Malta. However, they have a long wish list and finding a home close the city center with traditional Maltese features and modern amenities is going to be a challenge.",https://www.hgtv.com/shows/house-hunters-international/episodes/malta-discovered
60,"Season 114, Episode 6",Seeking Sun in Malta,"A couple and their two little boys trade their fast-paced life in Great Britain to spend more of their free time together on the beaches in Malta. But with her love of historic architecture and his craving for a modern home, they may struggle to find a compromise that everyone will love.",https://www.hgtv.com/shows/house-hunters-international/episodes/seeking-sun-in-malta
61,"Season 114, Episode 7",Dream House in Poland,"A Polish-Irish couple craving historic European culture decides to look for a new home in Konstancin, Poland. They want a character-filled home for their two daughters with a suburban feel, plenty of green space and easy access to Warsaw's city center.",https://www.hgtv.com/shows/house-hunters-international/episodes/dream-house-in-poland
62,"Season 114, Episode 8",Chasing Dreams in Prague,"When Francisco fell in love with his Czech teacher, Lenka, he didn't expect to live in the Czech Republic for good. Now, the family is looking for a new home where they can bring up their little daughter. With a tight budget and completely different boxes to tick on their wishlists, Lenka and Frank have to meet halfway to buy a dream home.",https://www.hgtv.com/shows/house-hunters-international/episodes/chasing-dreams-in-prague
63,"Season 114, Episode 9",Trading City Life for the Polish Seaside,"A young Australian couple decides to rediscover their Polish roots and move to the seaside town of Sopot, Poland. With him having the opportunity to work with his father and her being ready to explore a new place, they are excited about the European move. Looking for the perfect apartment might turn out to be a challenge, though, since they'll soon be a family of three!",https://www.hgtv.com/shows/house-hunters-international/episodes/trading-city-life-for-the-polish-seaside
64,"Season 114, Episode 10","Animal Lovers in Wroclaw, Poland","A young couple has decided to make a huge life change and move to Wroclaw, Poland. Swapping their big house in North Carolina for a small and cozy apartment in Poland, however, might turn out to be a challenge if they want to bring along their two beloved dogs. With their long wish list and a dream to live close to both work and a dog-friendly park, they'll have to decide what they are ready to compromise on.",https://www.hgtv.com/shows/house-hunters-international/episodes/animal-lovers-in-wroclaw-poland
65,"Season 114, Episode 11","Adventures in Wroclaw, Poland","Looking for new adventures and craving a European lifestyle, a young IT specialist leaves his family behind to start a new life in Wroclaw, Poland. With historic buildings in the center and modern, spacious apartments in the suburbs, Wroclaw has a lot to offer and he's counting on finding the perfect home. If he wants the best deal, however, he'll have to prioritize the items on his wish list. Having a friend by his side might also turn out to be helpful in making the final decision.",https://www.hgtv.com/shows/house-hunters-international/episodes/adventures-in-wroclaw-poland
66,"Season 114, Episode 12",Newlyweds in Prague,"New York City newlyweds Stephanie and Andrew jumped at a job opportunity that's taking them -- and their dog -- to Prague, Czech Republic. They're looking for a spacious apartment with a historic touch, and their long wish list includes a central location in close proximity to Andrew's work. In order to find the perfect place, this couple may have to meet halfway to reach the perfect compromise.",https://www.hgtv.com/shows/house-hunters-international/episodes/11400/newlyweds-in-prague
67,"Season 114, Episode 13",Discovering Budapest,"Stacy and Wes are trading their hectic life in Texas for European adventures and a slower pace in Budapest, Hungary. They plan to work from home, so they're looking for a place with office space and a balcony as well as a spacious kitchen. The couple must decide what features of a new apartment they're ready to compromise on so that they can soak up Hungarian culture and enjoy their new life abroad.",https://www.hgtv.com/shows/house-hunters-international/episodes/discovering-budapest
